department,title,ask,symptoms_tfidf,symptoms_textrank,symptoms_combined
营养保健科,小儿肥胖超重该如何治疗,女宝宝，刚7岁，这一年，察觉到，我家孩子身上肉很多，而且，食量非常的大，平时都不喜欢吃去玩，请问：小儿肥胖超重该如何治疗。,"超重,肥胖,小儿,食量","超重,肥胖,小儿","肥胖,超重,食量,小儿"
营养保健科,小儿肥胖超重该怎样医治,男孩子，刚4岁，最近，发现，我家孩子体重要比别的孩子重很多，而且，最近越来越能吃了，还特别的懒，请问：小儿肥胖超重该怎样医治。,"超重,肥胖,小儿","超重,肥胖,小儿","肥胖,超重,小儿"
营养保健科,小儿肥胖能吃该如何治疗,男宝，已经5岁，今年，察觉到，孩子身上越来越肉乎了，同时，吃的饭也比一般孩子多，平时都不喜欢吃去玩，请问：小儿肥胖能吃该如何治疗。,"肥胖,小儿","肥胖,小儿","肥胖,小儿"
营养保健科,小儿肥胖能吃该如何医治,女宝宝，目前2岁，近期，观察到，我家孩子越来越胖了，而且，吃起来好像也特别不节制，叫他运动也不愿意，请问：小儿肥胖能吃该如何医治。,"肥胖,小儿,节制,运动","肥胖,小儿,节制,运动","肥胖,节制,运动,小儿"
营养保健科,小儿肥胖懒应怎样治疗,男孩，7岁，上小学了，这一年，观察到，孩子身上越来越肉乎了，而且，食量非常的大，平时都不喜欢吃去玩，请问：小儿肥胖懒应怎样治疗。,"肥胖,懒应,小儿,食量","肥胖,懒应,小儿","肥胖,懒应,食量,小儿"
